{
  "format": 3,
  "makes": [
    {
      "id": "volkswagen",
      "label": "Volkswagen",
      "names": [
        "volkswagen",
        "vw"
      ],
      "group": "vag",
      "wmi": [
        "WVW",
        "WV1",
        "WV2"
      ]
    },
    {
      "id": "audi",
      "label": "Audi",
      "names": [
        "audi"
      ],
      "group": "vag",
      "wmi": [
        "WAU"
      ]
    },
    {
      "id": "seat",
      "label": "SEAT",
      "names": [
        "seat",
        "cupra"
      ],
      "group": "vag",
      "wmi": [
        "VSS"
      ]
    },
    {
      "id": "skoda",
      "label": "Škoda",
      "names": [
        "skoda"
      ],
      "group": "vag",
      "wmi": [
        "TMB"
      ]
    },
    {
      "id": "bmw",
      "label": "BMW",
      "names": [
        "bmw"
      ],
      "group": "bmw",
      "wmi": [
        "WBA"
      ]
    },
    {
      "id": "peugeot",
      "label": "Peugeot",
      "names": [
        "peugeot"
      ],
      "group": "stellantis",
      "wmi": [
        "VF3"
      ]
    },
    {
      "id": "citroen",
      "label": "Citroën",
      "names": [
        "citroen"
      ],
      "group": "stellantis",
      "wmi": [
        "VF7"
      ]
    },
    {
      "id": "ds",
      "label": "DS",
      "names": [
        "ds automobiles",
        "ds"
      ],
      "group": "stellantis",
      "wmi": []
    },
    {
      "id": "mercedes",
      "label": "Mercedes-Benz",
      "names": [
        "mercedes",
        "mercedes-benz",
        "mercedes benz"
      ],
      "group": "mercedes",
      "wmi": [
        "WDB",
        "WDC",
        "WDD",
        "W1K"
      ]
    },
    {
      "id": "ford",
      "label": "Ford",
      "names": [
        "ford"
      ],
      "group": "ford",
      "wmi": [
        "WF0",
        "1FA",
        "3FA"
      ]
    },
    {
      "id": "nissan",
      "label": "Nissan",
      "names": [
        "nissan"
      ],
      "group": "renault-nissan",
      "wmi": []
    }
  ],
  "models": [
    {
      "id": "volkswagen.golf",
      "make": "volkswagen",
      "label": "Volkswagen Golf",
      "names": [
        "golf"
      ]
    },
    {
      "id": "volkswagen.polo",
      "make": "volkswagen",
      "label": "Volkswagen Polo",
      "names": [
        "polo"
      ]
    },
    {
      "id": "volkswagen.passat",
      "make": "volkswagen",
      "label": "Volkswagen Passat",
      "names": [
        "passat"
      ]
    },
    {
      "id": "volkswagen.caddy",
      "make": "volkswagen",
      "label": "Volkswagen Caddy",
      "names": [
        "caddy"
      ]
    },
    {
      "id": "volkswagen.jetta",
      "make": "volkswagen",
      "label": "Volkswagen Jetta",
      "names": [
        "jetta"
      ]
    },
    {
      "id": "volkswagen.scirocco",
      "make": "volkswagen",
      "label": "Volkswagen Scirocco",
      "names": [
        "scirocco"
      ]
    },
    {
      "id": "volkswagen.touran",
      "make": "volkswagen",
      "label": "Volkswagen Touran",
      "names": [
        "touran"
      ]
    },
    {
      "id": "audi.a1",
      "make": "audi",
      "label": "Audi A1",
      "names": [
        "a1"
      ]
    },
    {
      "id": "audi.a3",
      "make": "audi",
      "label": "Audi A3",
      "names": [
        "a3"
      ]
    },
    {
      "id": "seat.ibiza",
      "make": "seat",
      "label": "SEAT Ibiza",
      "names": [
        "ibiza"
      ]
    },
    {
      "id": "seat.leon",
      "make": "seat",
      "label": "SEAT Leon",
      "names": [
        "leon"
      ]
    },
    {
      "id": "skoda.fabia",
      "make": "skoda",
      "label": "Škoda Fabia",
      "names": [
        "fabia"
      ]
    },
    {
      "id": "skoda.octavia",
      "make": "skoda",
      "label": "Škoda Octavia",
      "names": [
        "octavia"
      ]
    },
    {
      "id": "bmw.1series",
      "make": "bmw",
      "label": "BMW 1 Series",
      "names": [
        "1 series",
        "1er",
        "serie 1",
        "116d",
        "118d",
        "120d",
        "123d",
        "125d",
        "114i",
        "116i",
        "118i",
        "120i",
        "125i",
        "128i",
        "130i",
        "135i"
      ]
    },
    {
      "id": "bmw.2series",
      "make": "bmw",
      "label": "BMW 2 Series",
      "names": [
        "2 series",
        "2er",
        "serie 2",
        "216d",
        "218d",
        "220d",
        "225d",
        "218i",
        "220i",
        "228i",
        "230i"
      ]
    },
    {
      "id": "bmw.3series",
      "make": "bmw",
      "label": "BMW 3 Series",
      "names": [
        "3 series",
        "3er",
        "serie 3",
        "316d",
        "318d",
        "320d",
        "325d",
        "330d",
        "335d",
        "316i",
        "318i",
        "320i",
        "325i",
        "328i",
        "330i",
        "335i",
        "340i"
      ]
    },
    {
      "id": "bmw.5series",
      "make": "bmw",
      "label": "BMW 5 Series",
      "names": [
        "5 series",
        "5er",
        "serie 5",
        "518d",
        "520d",
        "525d",
        "530d",
        "535d",
        "520i",
        "523i",
        "525i",
        "528i",
        "530i",
        "535i",
        "540i",
        "550i"
      ]
    },
    {
      "id": "bmw.x1",
      "make": "bmw",
      "label": "BMW X1",
      "names": [
        "x1"
      ]
    },
    {
      "id": "bmw.x3",
      "make": "bmw",
      "label": "BMW X3",
      "names": [
        "x3"
      ]
    },
    {
      "id": "peugeot.208",
      "make": "peugeot",
      "label": "Peugeot 208",
      "names": [
        "208"
      ]
    },
    {
      "id": "peugeot.2008",
      "make": "peugeot",
      "label": "Peugeot 2008",
      "names": [
        "2008"
      ]
    },
    {
      "id": "peugeot.308",
      "make": "peugeot",
      "label": "Peugeot 308",
      "names": [
        "308"
      ]
    },
    {
      "id": "peugeot.3008",
      "make": "peugeot",
      "label": "Peugeot 3008",
      "names": [
        "3008"
      ]
    },
    {
      "id": "peugeot.5008",
      "make": "peugeot",
      "label": "Peugeot 5008",
      "names": [
        "5008"
      ]
    },
    {
      "id": "peugeot.partner",
      "make": "peugeot",
      "label": "Peugeot Partner",
      "names": [
        "partner"
      ]
    },
    {
      "id": "citroen.c3",
      "make": "citroen",
      "label": "Citroën C3",
      "names": [
        "c3"
      ],
      "excludeNames": [
        "c3 picasso",
        "c3 aircross"
      ]
    },
    {
      "id": "citroen.c3_picasso",
      "make": "citroen",
      "label": "Citroën C3 Picasso",
      "names": [
        "c3 picasso"
      ]
    },
    {
      "id": "citroen.c4",
      "make": "citroen",
      "label": "Citroën C4",
      "names": [
        "c4"
      ],
      "excludeNames": [
        "c4 cactus",
        "c4 picasso",
        "c4 grand picasso",
        "c4 spacetourer",
        "c4 grand spacetourer"
      ]
    },
    {
      "id": "citroen.c4_cactus",
      "make": "citroen",
      "label": "Citroën C4 Cactus",
      "names": [
        "c4 cactus"
      ]
    },
    {
      "id": "citroen.c4_picasso",
      "make": "citroen",
      "label": "Citroën C4 Picasso",
      "names": [
        "c4 picasso",
        "c4 grand picasso",
        "grand c4 picasso",
        "c4 spacetourer",
        "c4 grand spacetourer"
      ]
    },
    {
      "id": "citroen.berlingo",
      "make": "citroen",
      "label": "Citroën Berlingo",
      "names": [
        "berlingo"
      ]
    },
    {
      "id": "citroen.ds3",
      "make": "citroen",
      "label": "Citroën DS3",
      "names": [
        "ds3",
        "ds 3"
      ]
    },
    {
      "id": "citroen.ds4",
      "make": "citroen",
      "label": "Citroën DS4",
      "names": [
        "ds4",
        "ds 4"
      ]
    },
    {
      "id": "ds.ds3",
      "make": "ds",
      "label": "DS 3",
      "names": [
        "ds3",
        "ds 3",
        "3"
      ],
      "excludeNames": [
        "ds 3 crossback",
        "ds3 crossback",
        "3 crossback"
      ]
    },
    {
      "id": "ds.ds4",
      "make": "ds",
      "label": "DS 4",
      "names": [
        "ds4",
        "ds 4",
        "4"
      ]
    },
    {
      "id": "volkswagen.beetle",
      "make": "volkswagen",
      "label": "Volkswagen Beetle",
      "names": [
        "beetle"
      ]
    },
    {
      "id": "volkswagen.tiguan",
      "make": "volkswagen",
      "label": "Volkswagen Tiguan",
      "names": [
        "tiguan"
      ]
    },
    {
      "id": "seat.altea",
      "make": "seat",
      "label": "SEAT Altea",
      "names": [
        "altea",
        "altea xl"
      ]
    },
    {
      "id": "seat.toledo",
      "make": "seat",
      "label": "SEAT Toledo",
      "names": [
        "toledo"
      ]
    },
    {
      "id": "skoda.yeti",
      "make": "skoda",
      "label": "Škoda Yeti",
      "names": [
        "yeti"
      ]
    },
    {
      "id": "skoda.rapid",
      "make": "skoda",
      "label": "Škoda Rapid",
      "names": [
        "rapid"
      ]
    },
    {
      "id": "audi.a4",
      "make": "audi",
      "label": "Audi A4",
      "names": [
        "a4",
        "a4 avant",
        "a4 allroad",
        "allroad"
      ]
    },
    {
      "id": "audi.a5",
      "make": "audi",
      "label": "Audi A5",
      "names": [
        "a5",
        "a5 sportback",
        "a5 cabriolet"
      ]
    },
    {
      "id": "audi.a6",
      "make": "audi",
      "label": "Audi A6",
      "names": [
        "a6",
        "a6 avant"
      ]
    },
    {
      "id": "audi.a8",
      "make": "audi",
      "label": "Audi A8",
      "names": [
        "a8"
      ]
    },
    {
      "id": "audi.q3",
      "make": "audi",
      "label": "Audi Q3",
      "names": [
        "q3"
      ]
    },
    {
      "id": "audi.q5",
      "make": "audi",
      "label": "Audi Q5",
      "names": [
        "q5"
      ]